{
  "$schema": "../../../schemas/evals/routing-replay.schema.json",
  "type": "ROUTING_REPLAY_SET",
  "schemaVersion": 1,
  "name": "daily-driver-golden-routing-observations",
  "description": "Expected routing contracts after consolidation. Synthetic fixtures do not record model behavior.",
  "requiredCaseIds": [
    "active-goal-continuation-keeps-original-scope",
    "shell-check-tdd-uses-stable-red-green-proof",
    "push-request-means-branch-commit-push-pr",
    "issue-backend-selection-preserves-native-dependencies",
    "dirty-worktree-uses-scoped-git-change-flow",
    "ci-failure-triage-uses-remote-check-evidence",
    "plugin-install-recovery-proves-installed-state",
    "terminal-ui-work-preserves-cli-contracts",
    "technical-prose-uses-controlled-terms",
    "intellij-full-delivery-uses-default-profile",
    "intellij-existing-plugin-maintenance-discovers-repo-contract",
    "intellij-mixed-language-psi-targets-filter-before-access",
    "intellij-ui-testing-uses-starter-driver-contract",
    "kotlin-repository-work-preserves-task-and-topology-proof",
    "kotlin-application-stack-keeps-library-bindings-private",
    "plugin-history-audit-separates-evidence",
    "installed-discovery-recovery-keeps-stage-proof",
    "runtime-performance-matches-semantic-workloads",
    "openwiki-refresh-preserves-backend-authority",
    "cli-finite-json-errors-preserve-exit-status",
    "docs-site-nav-preserves-generated-boundaries",
    "technical-rfc-keeps-reader-decision-source-backed",
    "openapi-operations-preserve-request-response-security",
    "openapi-review-requires-validator-evidence",
    "pr-feedback-repair-rechecks-current-head",
    "prose-only-edit-keeps-validation-skills-idle",
    "proof-preservation-requires-strong-consumers",
    "api-variants-retain-domain-proof",
    "shell-failure-preserves-transition-contract",
    "proof-loss-review-names-model-obligations",
    "pkl-workflows-do-not-install-automation",
    "pkl-checks-carry-runtime-without-workflow-discovery",
    "pkl-checks-preserve-runtime-contract",
    "gradle-natural-request-keeps-explicit-skill-idle",
    "kotlin-coroutine-flow-design-uses-existing-owner",
    "kotlin-coroutine-review-keeps-read-only-scope",
    "kotlin-unit-tests-own-state-and-real-components",
    "kotlin-expression-flow-keeps-explicit-results"
  ],
  "observations": [
    {
      "type": "ROUTING_OBSERVATION",
      "caseId": "active-goal-continuation-keeps-original-scope",
      "routedPrimitive": {
        "type": "SKILL",
        "name": "tdd"
      },
      "satisfiedAllowedActions": [
        "Preserve the original objective and derive concrete requirements before claiming completion.",
        "Use the current worktree and validation output as authoritative evidence.",
        "Leave the goal active when production-readiness and team-sharing evidence remain incomplete."
      ],
      "satisfiedVerificationEvidence": [
        "The run inspects current files or external state before acting.",
        "The final handoff names completed evidence and leaves unproven production-sharing scope open when appropriate."
      ],
      "avoidedForbiddenActions": [
        "Redefine success around the easiest passing subset.",
        "Mark the goal complete from intent, partial progress, or plausible final wording.",
        "Skip current-state inspection because earlier context sounds familiar."
      ],
      "notes": "A passing continuation keeps the active objective intact and reports incomplete rollout evidence instead of claiming done."
    },
    {
      "type": "ROUTING_OBSERVATION",
      "caseId": "shell-check-tdd-uses-stable-red-green-proof",
      "routedPrimitive": {
        "type": "SKILL",
        "name": "tdd"
      },
      "satisfiedAllowedActions": [
        "Declare one check specification with working directory, exact command, controlled inputs, expected RED failure, and GREEN criterion.",
        "Observe the focused check fail for the intended missing behavior, then pass the same check specification after the narrow implementation.",
        "Use the standalone tdd primitive from software-engineering without loading Git or CI delivery workflows that were not requested."
      ],
      "satisfiedVerificationEvidence": [
        "RED and GREEN cite the same working directory, command, controlled inputs, and meaningful environment.",
        "The RED signal names the missing behavior and the GREEN result exits zero after the narrow implementation."
      ],
      "avoidedForbiddenActions": [
        "Count command-not-found, dependency setup, malformed check syntax, timeout, permission, or unrelated failures as RED.",
        "Change the implementation before observing an intended focused failure.",
        "Load software-engineering only because the TDD oracle is invoked from a shell."
      ],
      "notes": "A passing run uses the generic tdd primitive for stable shell-check proof and leaves Git/CI unloaded when delivery is not requested."
    },
    {
      "type": "ROUTING_OBSERVATION",
      "caseId": "push-request-means-branch-commit-push-pr",
      "routedPrimitive": {
        "type": "SKILL",
        "name": "pull-request-lifecycle"
      },
      "satisfiedAllowedActions": [
        "Inspect status and preserve unrelated dirty or untracked files.",
        "Stage only the scoped change set.",
        "Commit, push, open the PR, and include validation evidence when the user asked for that delivery."
      ],
      "satisfiedVerificationEvidence": [
        "Git status before staging shows unrelated work was identified.",
        "The PR or pushed branch contains only scoped files and cites validation commands."
      ],
      "avoidedForbiddenActions": [
        "Stop after local validation when the user explicitly asked to push or raise a PR.",
        "Use broad staging that captures unrelated user work.",
        "Open a PR without a concise rationale and residual-risk note."
      ],
      "notes": "A passing delivery run treats push/PR language as an end-to-end delivery request while preserving unrelated work."
    },
    {
      "type": "ROUTING_OBSERVATION",
      "caseId": "issue-backend-selection-preserves-native-dependencies",
      "routedPrimitive": {
        "type": "SKILL",
        "name": "issue-tracker-operations"
      },
      "satisfiedAllowedActions": [
        "Resolve the backend from an explicit override or EFFECTIVE_DELIVERY_ISSUE_BACKEND.",
        "Inspect declared capabilities before provider execution.",
        "Read the issue and direct blocker map through the facade, then preserve BLOCKS direction and bounded coverage."
      ],
      "satisfiedVerificationEvidence": [
        "The result names GITHUB or JIRA and records gh or acli command evidence.",
        "The direct map declares depth one and marks hierarchy and transitive traversal unsupported."
      ],
      "avoidedForbiddenActions": [
        "Invoke the legacy jira executable or route through jira-resolve-ticket.",
        "Infer blocker links from issue body text or labels.",
        "Represent hierarchy or transitive traversal as complete direct blocker evidence.",
        "Run a provider-specific remote write outside the facade capability contract."
      ],
      "notes": "A passing issue read selects one declared backend and retains native relationship evidence without provider-specific writes."
    },
    {
      "type": "ROUTING_OBSERVATION",
      "caseId": "dirty-worktree-uses-scoped-git-change-flow",
      "routedPrimitive": {
        "type": "SKILL",
        "name": "git-change-flow"
      },
      "satisfiedAllowedActions": [
        "Start with Git status and inspect the relevant unstaged diff before staging.",
        "Treat uncommitted changes outside the requested scope as user work and leave them untouched.",
        "Stage only requested paths, review the cached diff, and run git diff --cached --check."
      ],
      "satisfiedVerificationEvidence": [
        "Before-and-after Git status shows unrelated files remain intact and unstaged.",
        "The cached diff contains only requested paths and git diff --cached --check succeeds."
      ],
      "avoidedForbiddenActions": [
        "Run git add -A when the whole dirty tree is not in scope.",
        "Stash, revert, overwrite, amend, or rebase unrelated user work without explicit authority.",
        "Claim scoped commit readiness without reviewing the staged diff."
      ],
      "notes": "A passing local Git run isolates requested paths in the index and preserves every unrelated working-tree change."
    },
    {
      "type": "ROUTING_OBSERVATION",
      "caseId": "ci-failure-triage-uses-remote-check-evidence",
      "routedPrimitive": {
        "type": "SKILL",
        "name": "github-ci-operations"
      },
      "satisfiedAllowedActions": [
        "Inspect current PR, run, job, and log state with GitHub-backed evidence.",
        "Patch the narrow source or workflow surface that explains the failing job.",
        "Push and re-check the relevant run or PR checks when remote verification is in scope."
      ],
      "satisfiedVerificationEvidence": [
        "The handoff cites the current PR, run ID, job name, or check conclusion.",
        "The repair is validated by a local command or the updated remote check result."
      ],
      "avoidedForbiddenActions": [
        "Rely only on stale local assumptions about which check failed.",
        "Treat a workflow edit as successful without checking the new remote result.",
        "Ignore the same failure signature repeating across jobs."
      ],
      "notes": "A passing CI triage run ties the fix to live check evidence and re-verifies after the repair."
    },
    {
      "type": "ROUTING_OBSERVATION",
      "caseId": "ci-status-claims-use-structured-check-evidence",
      "routedPrimitive": {
        "type": "SKILL",
        "name": "github-ci-operations"
      },
      "satisfiedAllowedActions": [